{
  "$schema": "https://json-schema.org/draft/2020-12/schema",
  "$id": "mx://schemas/v2/inventory-graph.schema.json",
  "schemaVersion": "2.0.0",
  "title": "InventoryGraph",
  "description": "The dependency graph of the legacy app. Node and edge KINDS are a neutral vocabulary that covers any component framework; the exact framework construct (Angular2+ NgModule, React hook, Vue composable, etc.) and its rich metadata live in each node's `sourceAdapter`. This keeps all framework-specific node kinds, construct metadata, DI styles, and edge kinds out of the core.",
  "type": "object",
  "required": ["schemaVersion", "sourceFramework", "generatedAt", "sourceRoots", "nodes", "edges", "unaccounted"],
  "properties": {
    "schemaVersion": { "type": "string", "const": "2.0.0" },
    "sourceFramework": { "$ref": "common.schema.json#/$defs/frameworkDescriptor" },
    "generatedAt": { "type": "string", "format": "date-time" },
    "sourceRoots": { "type": "array", "items": { "type": "string" } },
    "scannerVersion": { "type": "string" },
    "nodes": {
      "type": "array",
      "items": {
        "type": "object",
        "required": ["nodeId", "kind", "declaredIn"],
        "properties": {
          "nodeId": { "type": "string", "description": "Neutral, opaque id, e.g. 'module:app.invoices | component:invoiceTable | service:InvoiceService | template:invoices/list.html | route:/invoices | external:jquery.floatThead'." },
          "kind": {
            "description": "Neutral node classification. Mapping examples — Angular2+ component→'component', directive→'presentation' or 'behavior', pipe→'transform', injectable→'service', NgModule→'module'. React component→'component', hook→'behavior', context provider→'store'.",
            "enum": ["module", "component", "presentation", "behavior", "service", "config", "transform", "template", "route", "store", "external", "vendored", "dead", "asset", "entrypoint"]
          },
          "declaredIn": { "type": "string" },
          "lines": { "type": "array", "items": { "type": "integer" } },
          "dependencyInjection": {
            "type": "object",
            "description": "NEUTRAL DI summary. The framework-specific DI style (Angular2+ constructor tokens/inject(), React context/hooks) lives in sourceAdapter.",
            "properties": {
              "injects": { "type": "array", "items": { "type": "string" }, "description": "Ids/tokens this node depends on." }
            }
          },
          "templateRefs": { "type": "array", "items": { "type": "string" } },
          "usageCount": { "type": "object", "properties": { "static": { "type": "integer" }, "runtime": { "type": ["integer", "null"] } } },
          "unitId": { "type": ["string", "null"] },
          "sourceAdapter": {
            "description": "Framework-specific node metadata. For Angular2+ it carries selector/standalone/inputs/outputs/signals/providers (see adapters/angular2plus.schema.json).",
            "$ref": "adapter-ref.schema.json"
          }
        }
      }
    },
    "edges": {
      "type": "array",
      "items": {
        "type": "object",
        "required": ["from", "to", "kind", "foundBy"],
        "properties": {
          "from": { "type": "string" },
          "to": { "type": "string" },
          "kind": {
            "description": "Neutral edge classification. Mapping — Angular2+ 'di-inject'→'depends-on'; 'route-loads'→'routes-to'; 'template-uses-component'→'renders'; 'content-projection'→'projects-into'; 'output-binding'→'emits'/'listens'; 'pipe-in-template'→'transforms-in'; external-library use→'uses-external'; 'module-imports'→'module-depends'.",
            "enum": ["depends-on", "routes-to", "renders", "projects-into", "emits", "listens", "controls", "transforms-in", "uses-external", "module-depends", "dynamic-unresolved"]
          },
          "foundBy": { "enum": ["static-ast", "template-ref", "string-match", "runtime-trace", "inferred"] },
          "site": { "type": "string" },
          "sourceAdapter": {
            "description": "Optional framework-specific edge detail (e.g. Angular2+ content-projection selector, DI token name).",
            "$ref": "adapter-ref.schema.json"
          }
        }
      }
    },
    "unaccounted": { "type": "array", "items": { "type": "string" }, "description": "MUST be empty before planning exit." }
  }
}
