{
  "schemaVersion": "2.0.0",
  "sourceFramework": {
    "id": "angular",
    "version": "17.3.0",
    "role": "source"
  },
  "generatedAt": "2026-07-17T12:00:00Z",
  "sourceRoots": [
    "src/app"
  ],
  "nodes": [
    {
      "nodeId": "component:invoiceTable",
      "kind": "component",
      "declaredIn": "src/app/invoice-table.component.ts",
      "lines": [
        1,
        200
      ],
      "dependencyInjection": {
        "injects": [
          "service:InvoiceService"
        ]
      },
      "templateRefs": [
        "invoices/list.html"
      ],
      "usageCount": {
        "static": 3,
        "runtime": null
      },
      "unitId": "unit:component:invoiceTable",
      "sourceAdapter": {
        "adapterId": "angular2plus",
        "adapterVersion": "2.0.0",
        "data": {
          "construct": "component",
          "selector": "app-invoice-table",
          "standalone": true,
          "changeDetection": "OnPush"
        }
      }
    }
  ],
  "edges": [
    {
      "from": "component:invoiceTable",
      "to": "service:InvoiceService",
      "kind": "depends-on",
      "foundBy": "static-ast",
      "site": "constructor",
      "sourceAdapter": {
        "adapterId": "angular2plus",
        "adapterVersion": "2.0.0",
        "data": {
          "relation": "di-inject",
          "tokenName": "InvoiceService"
        }
      }
    }
  ],
  "unaccounted": [],
  "scannerVersion": "1.4.2"
}
